{
  "id": "RP-0001",
  "session_id": "run-2025-10-22-so-a",
  "issued_at": "2025-10-22T20:10:00Z",
  "loop_state": "revision",
  "cycle": 2,
  "answers": [
    {
      "q": "Could a maintenance bay realistically control station-wide lockdown on a frontier relay?",
      "claim": "Yes, with legacy overrides and physical interlocks common to modular stations.",
      "confidence": 0.6,
      "evidence": [
        {
          "source": {"title": "Industrial Control System Lockouts", "url": "https://example.test/ics-lockouts", "publisher": "Tech Journal", "date": "2018"},
          "support": "supports",
          "quote": "Lockouts are often centralized in maintenance hubs on older platforms."
        }
      ],
      "resolution": "use",
      "routing": ["plot_drafter", "scene_smith"]
    }
  ],
  "bibliography": [
    {"title": "Modular Station Designs", "url": "https://example.test/modular-stations"}
  ]
}
